<?xml version='1.0' encoding='UTF-8'?>
<kpeiInbound xmlns="http://www.kpei.co.id/razor/RefData_Intraday_Delete" xmlns:xsi="http://www.w3.org/2001/XMLSchema-instance" xsi:schemaLocation="http://www.kpei.co.id/razor/RefData_Intraday_Delete file:/C:/WORK/DEVELOPMENT/ARIS-KPEI-PROJECT/OR01-ARMSMember/xsd/RefData_Intraday_Delete.xsd">
   <header id="id261">
      <asAt>2010-03-31T12:13:44.073</asAt>
      <sourceSystem>source262</sourceSystem>
   </header>
   <body>
      <deleteRiskPointDomainRecords>
         <riskPointDomain id="Value251">
            <record id="idMember263"/>
         </riskPointDomain>
      </deleteRiskPointDomainRecords>
   </body>
</kpeiInbound>
